{
  "schema_version": "1.0", "scenario_id": "GS-004", "event_id": "EVT-GS-004",
  "equipment": {"equipment_id": "CNC-S04-L02-03", "display_name": "4구역 · 2셀 · CNC 가공기 3", "asset_type": "cnc", "site_id": "S04", "cell_id": "S04-L02", "line": "S04-L02", "criticality": "high", "assigned_engineer": "최민호", "last_maintenance_date": "2026-06-15", "estimated_downtime_minutes": 240, "spare_part_available": false},
  "observation": {"timestamp": "2026-08-01T00:00:00+09:00", "product_type": "L", "air_temperature_k": 300.0, "process_temperature_k": 310.0, "rotational_speed_rpm": 1700, "torque_nm": 75.0, "tool_wear_min": 210},
  "history": [
    {"timestamp": "2026-07-31T00:00:00+09:00", "product_type": "L", "air_temperature_k": 298.7, "process_temperature_k": 303.8, "rotational_speed_rpm": 1512, "torque_nm": 43.0, "tool_wear_min": 186},
    {"timestamp": "2026-07-31T01:00:00+09:00", "product_type": "L", "air_temperature_k": 298.6, "process_temperature_k": 303.6, "rotational_speed_rpm": 1508, "torque_nm": 42.6, "tool_wear_min": 187},
    {"timestamp": "2026-07-31T02:00:00+09:00", "product_type": "L", "air_temperature_k": 298.5, "process_temperature_k": 303.5, "rotational_speed_rpm": 1505, "torque_nm": 42.8, "tool_wear_min": 187},
    {"timestamp": "2026-07-31T03:00:00+09:00", "product_type": "L", "air_temperature_k": 298.5, "process_temperature_k": 303.7, "rotational_speed_rpm": 1510, "torque_nm": 43.4, "tool_wear_min": 188},
    {"timestamp": "2026-07-31T04:00:00+09:00", "product_type": "L", "air_temperature_k": 298.8, "process_temperature_k": 304.1, "rotational_speed_rpm": 1518, "torque_nm": 44.1, "tool_wear_min": 188},
    {"timestamp": "2026-07-31T05:00:00+09:00", "product_type": "L", "air_temperature_k": 299.0, "process_temperature_k": 304.6, "rotational_speed_rpm": 1524, "torque_nm": 44.6, "tool_wear_min": 189},
    {"timestamp": "2026-07-31T06:00:00+09:00", "product_type": "L", "air_temperature_k": 299.2, "process_temperature_k": 305.0, "rotational_speed_rpm": 1531, "torque_nm": 45.2, "tool_wear_min": 189},
    {"timestamp": "2026-07-31T07:00:00+09:00", "product_type": "L", "air_temperature_k": 299.4, "process_temperature_k": 305.6, "rotational_speed_rpm": 1538, "torque_nm": 46.1, "tool_wear_min": 190},
    {"timestamp": "2026-07-31T08:00:00+09:00", "product_type": "L", "air_temperature_k": 299.6, "process_temperature_k": 306.2, "rotational_speed_rpm": 1546, "torque_nm": 47.3, "tool_wear_min": 190},
    {"timestamp": "2026-07-31T09:00:00+09:00", "product_type": "L", "air_temperature_k": 299.7, "process_temperature_k": 306.8, "rotational_speed_rpm": 1554, "torque_nm": 48.1, "tool_wear_min": 191},
    {"timestamp": "2026-07-31T10:00:00+09:00", "product_type": "L", "air_temperature_k": 299.8, "process_temperature_k": 307.2, "rotational_speed_rpm": 1561, "torque_nm": 49.0, "tool_wear_min": 191},
    {"timestamp": "2026-07-31T11:00:00+09:00", "product_type": "L", "air_temperature_k": 299.8, "process_temperature_k": 307.6, "rotational_speed_rpm": 1566, "torque_nm": 50.2, "tool_wear_min": 192},
    {"timestamp": "2026-07-31T12:00:00+09:00", "product_type": "L", "air_temperature_k": 299.9, "process_temperature_k": 308.0, "rotational_speed_rpm": 1572, "torque_nm": 51.1, "tool_wear_min": 193},
    {"timestamp": "2026-07-31T13:00:00+09:00", "product_type": "L", "air_temperature_k": 300.0, "process_temperature_k": 308.4, "rotational_speed_rpm": 1578, "torque_nm": 52.6, "tool_wear_min": 194},
    {"timestamp": "2026-07-31T14:00:00+09:00", "product_type": "L", "air_temperature_k": 300.0, "process_temperature_k": 308.7, "rotational_speed_rpm": 1585, "torque_nm": 54.0, "tool_wear_min": 195},
    {"timestamp": "2026-07-31T15:00:00+09:00", "product_type": "L", "air_temperature_k": 300.1, "process_temperature_k": 309.0, "rotational_speed_rpm": 1592, "torque_nm": 55.4, "tool_wear_min": 196},
    {"timestamp": "2026-07-31T16:00:00+09:00", "product_type": "L", "air_temperature_k": 300.1, "process_temperature_k": 309.2, "rotational_speed_rpm": 1600, "torque_nm": 56.8, "tool_wear_min": 197},
    {"timestamp": "2026-07-31T17:00:00+09:00", "product_type": "L", "air_temperature_k": 300.2, "process_temperature_k": 309.4, "rotational_speed_rpm": 1608, "torque_nm": 58.4, "tool_wear_min": 198},
    {"timestamp": "2026-07-31T18:00:00+09:00", "product_type": "L", "air_temperature_k": 300.2, "process_temperature_k": 309.5, "rotational_speed_rpm": 1618, "torque_nm": 60.2, "tool_wear_min": 199},
    {"timestamp": "2026-07-31T19:00:00+09:00", "product_type": "L", "air_temperature_k": 300.1, "process_temperature_k": 309.6, "rotational_speed_rpm": 1630, "torque_nm": 62.1, "tool_wear_min": 201},
    {"timestamp": "2026-07-31T20:00:00+09:00", "product_type": "L", "air_temperature_k": 300.1, "process_temperature_k": 309.7, "rotational_speed_rpm": 1642, "torque_nm": 64.2, "tool_wear_min": 203},
    {"timestamp": "2026-07-31T21:00:00+09:00", "product_type": "L", "air_temperature_k": 300.0, "process_temperature_k": 309.8, "rotational_speed_rpm": 1655, "torque_nm": 67.0, "tool_wear_min": 205},
    {"timestamp": "2026-07-31T22:00:00+09:00", "product_type": "L", "air_temperature_k": 300.0, "process_temperature_k": 309.9, "rotational_speed_rpm": 1670, "torque_nm": 70.4, "tool_wear_min": 207},
    {"timestamp": "2026-07-31T23:00:00+09:00", "product_type": "L", "air_temperature_k": 300.0, "process_temperature_k": 310.0, "rotational_speed_rpm": 1684, "torque_nm": 73.0, "tool_wear_min": 209}
  ],
  "runtime": {"llm_available": true, "planner_available": true, "context_provider": "fixture"},
  "expected": {"risk_band": "critical", "recommended_decision": "review_shutdown", "confidence": "high", "predicted_failure_type": "power_or_overstrain_failure"}
}
