{
  "schema_version": "1.0", "scenario_id": "GS-003", "event_id": "EVT-GS-003",
  "equipment": {"equipment_id": "CNC-S01-L04-03", "display_name": "1구역 · 4셀 · CNC 가공기 3", "asset_type": "cnc", "site_id": "S01", "cell_id": "S01-L04", "line": "S01-L04", "criticality": "high", "assigned_engineer": "이서준", "last_maintenance_date": "2026-07-10", "estimated_downtime_minutes": 150, "spare_part_available": true},
  "observation": {"timestamp": "2026-08-01T00:00:00+09:00", "product_type": "H", "air_temperature_k": 302.0, "process_temperature_k": 309.0, "rotational_speed_rpm": 1300, "torque_nm": 45.0, "tool_wear_min": 80},
  "history": [
    {"timestamp": "2026-07-31T23:45:00+09:00", "product_type": "H", "air_temperature_k": 300.8, "process_temperature_k": 309.0, "rotational_speed_rpm": 1380, "torque_nm": 43.0, "tool_wear_min": 76},
    {"timestamp": "2026-07-31T23:50:00+09:00", "product_type": "H", "air_temperature_k": 301.2, "process_temperature_k": 309.0, "rotational_speed_rpm": 1350, "torque_nm": 44.0, "tool_wear_min": 77},
    {"timestamp": "2026-07-31T23:55:00+09:00", "product_type": "H", "air_temperature_k": 301.6, "process_temperature_k": 309.0, "rotational_speed_rpm": 1325, "torque_nm": 44.5, "tool_wear_min": 79},
    {"timestamp": "2026-08-01T00:00:00+09:00", "product_type": "H", "air_temperature_k": 302.0, "process_temperature_k": 309.0, "rotational_speed_rpm": 1300, "torque_nm": 45.0, "tool_wear_min": 80}
  ],
  "runtime": {"llm_available": true, "planner_available": true, "context_provider": "fixture"},
  "expected": {"risk_band": "warning", "recommended_decision": "request_inspection", "confidence": "high", "predicted_failure_type": "heat_dissipation_failure"}
}
